RequirementText,class
SEVERE Performance impact when migrated from Hibernate 3 to Hibernate 5,1
XmlHttpRequest or iframe to load a web application?,1
"I have a spring boot application with quite a simple service, repository classes defined, with db queries. But when I run it I get an error",5
Undefined method 'encodePassword'. - error in Apiplateform security encoder undefined,5
AWS private S3 bucket available from authenticated URL,5
Is this URL encoding safe?,5
ambiguity of complexity analysis of for loop containing O(1) operations,1
Efficiently computing difference matrix based on Pandas series,1
The efficient way to compare value between two cell and assign value based on condition in Numpy,1
Why does my localhost application on Node.js take so long/refuse to connect?,1
Efficiency in Perfect number code (Python),1
integrate/pracma::integral alternative,1
Dns amplification attack demo,5
"What to do with ""branched"" folders in neo4j",0
Combining Where and OrderByDescending Using a Custom Method,1
Verify identity of another process running on the same physical machine,5
C++20 semaphore in queue application seems slow compared to condition variable,1
"Why is tf.concat much slower than np.concatenate and the ""append"" of the native python list? Should we avoid if possible?",1
$classInstance->title is faster than $classInstance->getTitle() - so why do most people use the slower method?,4
How do I manage metainformation in a horizontally scaled game server?,4
Is there any way to turn off trigger on MariaDB?,1
How much data transferred from PostgreSQL to Redis in one batch is considered reliable?,4
Is it safe to add connection strings to version control?,5
Runnable's run method runs faster in android,1
Angular: how to set up Content-Security-Policy & Trusted Types?,5
Portability with using c++11 / recent g++ versions (4.7/4.6),3
ASP.NET on Mono scalability,4
windows memory formatting issue,3
User Search Strategy Mobile Dev,1
https: what can go wrong if the certificate validation step perfomed by browser was eliminated?,5
Tuning with classification_cost and custom cost matrix in Tidymodels,1
MySQL 8.0 Performance on large datasets,1
Is there any method to decrease tensorflow lite invoke time in c++?,1
Portable way to print function pointers?,3
Addition between int datatypes and custom class datatypes in c++ to get higher performance,1
JQuery vulnerabilities with the latest Jenkins and how to fix them?,5
Multiple writers and readers in microservices approach,4
Preventing Cross-Site Scripting (XSS) attack for HttpServletRequest.getHeader(),5
Application Engineering and Number of Users,4
Performance: Pandas index.intersection() vs set intersection,1
Eigen::VectorXd::operator += seems ~69% slower than looping through a std::vector,1
Security check on BSC token,5
Why is my implementation of merge sort slow?,1
How to tell whether an executable was compiled for the present machine?,3
Concrete 5 CMS Scalability and Speed,4
What is the risk of data capture/leak from web extensions when we run this tool on webpage?,5
MySQL SQL Performance need some improvement,1
Is there a risk of exposing your static ddns cloud hostname (yourhost.ddns.net) on public wifi?,5
see execution time of javascript code next to each call,1
why ebpf can ensure safe than lkm,5
Getting Resource performance data of a specific fetch/xhr call in JavaScript Resource Timing API from a Service Worker,1
How to Prevent External Service Interaction (DNS),5
Sending Java Objects over replica tcp sockets,6
When to use a flat file over RDMS/NOSQL/etc,4
Why the sizes of IR is different but the size of executable files become same? And how to compare performance by static analysis?,1
Flatlist inside into Scrollview,1
Bash - Text stored in variable is not recognized when put it as argument,3
How do I use performance.measureMemory() API for frontend observability?,1
Docker pull so slow,1
Where to store Social Login Oauth2 access tokens,5
Cross Domain Session,5
Does using stateful web servers make sense?,4
Ways for verify mobile application client on server,5
Trouble installing Mechanize with Strawberry (portable) Perl (for Windows 7),3
Linux Browsers And VBScript,3
chef cookbook that I have for installing MCAfee security agent directly from the MCAfee website and configure for automatic updates,5
Scaleable backend - self hosted?,4
Do Jira/Confluence Data Center Edition support master-master database cluster?,0
Binary does not work when PIE and Partial RELRO are enabled together,5
Julia: Abstract types vs Union of types,1
Why is .NET performance so good?,1
Is size_t portable?,3
Understanding MPI multi-host mode,1
Import a .pem file in to a Java Keystore with valid key pair,5
High traffic ASP.NET MVC coding considerations,4
Logging requests into database,5
HAProxy health check with backend ssl servers,0
How to return an HTTP response from consumer microservice?,0
Caching data with class properties - why is it a bad idea?,4
How to refresh a MySQL table without website interruption?,0
security concerns for storing bearer token in cookie for embedded iframe pages to consume,5
Make PHP-FPM security.limit_extensions case insensitive,5
"python - ""merge based on a partial match"" - Improving performance of function",1
How to reduce the cold start time when using MySQL with Lambda?,1
Client Server: How to make it more difficult for client to modify their source code,5
JMeter - How to know which request fails?,1
Scala Seq vs List vs MutableList performance (foldLeft),1
Firebase security against modified APK and MITM attacks,5
Code splitting in Next JS 3 to get smaller bundle size in Lighthouse,1
How does HTTPS affect caching and security?,5
How can I portably send a C struct through a network socket?,3
Generating huge amount of hashes,1
How people inject malicious code on my webpage?,5
Making a dictionary of data frames from pandas data frame without writing it to excel file,1
Symfony's Prevent RCE when calling untrusted remote with CachingHttpClient error,5
"Why in the C language loop, accessing array elements is so much slower than accessing variables？ [duplicate]",1
"What is the most performant method to calculate the sum of lcm(i, j), i and j ranging from 1 to k?",1
block IP address on MAC,5
Safely escape out String before EVAL(),5
How to implement JWT for Guest Users,5
"How to improve ""select min(my_col)"" query in MySQL without adding and index",1
What's the wrong with making the ApplicationCookie SameSite=Strict in IdentityServer4?,5
How to link old C code with reserved keywords in it with C++?,3
How to ensure that the user does not modify what he wants by changing the id of the object supposed to be modified via a form?,5
How to conditionally apply where clause in Rails?,1
Connection refused error with AWS + Hashicorp Vault,5
How to retrieve SecurityContext in a Quarkus application?,5
WPF: Can styles be used to format a user control for two different scenarios?,2
"Overlapping regular expression substitution in Python, but contingent on values of capture groups",1
"Any issues with LAMP stack for web app? (security, scalability, speed, functionality, etc.) [closed]",4
Is it reliable to check stripe subscription status in frontend?,5
condition checking on signatures of template of a class (Ex. HashSet + HashMap),2
Checking if hashed values are the same,5
"Slow for loop speed in python using pandas, how to improve the strucutre?",1
How to scale a very short expiry of auth_token?,4
Ergonomic way of only adding a new object to a map if it doesn't exist?,1
What is a generic and portable way to get at underlying bits of a type in C++?,3
Active Namenode is Down in Hadoop,0
"Tetris getting slower every time I complete a row (Python, Turtle)",1
Can I add Microsoft Azure WAF as an standalone resource rather than using Application Gateway or Front Door?,5
Root cause analysis of web server performance problems,1
Rate limit the amount of content throughout a forEach iteration,1
Scalability Azure Function/AWS Lamda,4
"Fitness Function - What to do, if value of one Chromosome features is much higher than other ones",4
"Just opened an HTM file with the following code, is it dangerous?",5
Steps needed to configure HBase in a HA mode in apache hadoop2?,0
Is it bad practice to export all components into an index.js file?,1
.NET Socketserver max concurrent connections and max value for backlog,4
PostgreSQL - Fail to start delegate ip address on pgpool 2,0
OpenGL Meshing Slower Than Not Meshing,1
Setting up DB2 HADR for existing database,0
Is it more efficient to declare helper functions outside the main function?,1
How to compare multi-value duplicates in Dataframe,1
Custom gradient tape-based fit() function is slower than Tf2 fit() and has memory leaking,1
What information can we tell about a telebot using its username?,5
Catalina - How to Open a html file Using file:// - Sandbox / Security,5
Is an AES-256 encryption-decryption a heavy job?,5
Reading a hash from a file on disk [duplicate],0
Generating UIDs in a multi-instance and multi-threaded environment,0
How to check if url is protected or not in TomEE?,5
"R: pass entire dataframe as argument to custom function, or just needed columns?",2
What is Big O of two loops,1
ThreadPool.SetMinThreads as Warm-Up strategy,4
Is there a better way to optimize for the CSS of my Next.js project?,1
Bookshelf.js fetchAll() performance,1
"Tests fail ONLY on one python version, and the diffs only show README change. How's that possible?",3
how to generate list of sequence number in faster way using python,1
Conditionally print debug info containing sensitive data,5
Shell script to divide csv files automatically using thread group count,1
Index.php file has been modified in WordPress (detected by Wordfence),5
Analysing JVM performance issue,1
How applicable is the command pattern in this attempt to decouple layers? [closed],2
Two master instances on same database,0
"Where to store image,in database or server folder",4
Moderate severity vulnerabilities found after running npx create-react-app,5
Laravel Sail / Docker is too slow on Mac: optimization possible? [duplicate],1
How to make cluster with playframework application,4
WSO2 ESB High Availability,0
Scaling Redis for Online Friends List,4
Apache 403 on windows using AliasMatch and -D,3
"Quickest way to find a polygon that is referred by a point (Using Python, Fiona and Shapely)",1
Optimizing landing pages,4
Is HTTPS required if my service is only called/exposed within K8 cluster [closed],5
Python Polynomial Calculation Efficiency,1
This framework cannot be suitable for large scale project? [closed],4
How to externalize Django's Media Data and Serve it to the Frontend,4
What is the best way to maintain and make secure session? Code I use at the moment,5
"502 bad gateway on thin server, why?",4
how to implement high availability of mysql in windows?,0
"What particular practices, designs, languages/features enable very easy to maintain code?",2
Horizontal scaling with Spring Batch,4
I am getting error when i run this code to make raspberry pi face tracking robot with gui without any servo motor just to follow only people,1
Safest method to save passwords,5
How to allow cross origin requests for all https domains,5
"Monitor cpu usage, gpu memory usage, swap memory usage and ram usage",1
Scalability issues for a complex process consuming php application?,4
how to use portable imagemagick in php Exec(),3
numpy arrays vs core python lists [duplicate],1
How to make two arrays contiguous so that Numba can speed up np.dot(),1
How to start with dockerized application load/performance testing with multi nodes of docker? [closed],1
How do I create a fully isolated production environment (Air Gap) in Azure Dev Ops?,5
Does running two scripts in parallel on a dual-core CPU decrease the speed as compared to running them serially?,1
How to test server performance,1
Geo cluster with pacemaker - quorum vs booth,0
Scalability advice for large game site,4
Hide credentials in package development in R,5
Why Spring Security getAuthentication() returns null on server,5
Is it better to add elements to a set or to convert list a into a set?,1
How to implement addEventListener efficiently?,1
Obfuscating data for other roles in Postgres,5
Efficient Matching Algorithm for Set Based Triplets,4
Kernel module performance test issues,1
Specify Domain Level for Clear-Site-Data / Subdomains,5
replication normal mysql to cluster,4
Flex poker game scaling in Google Apps Engine vs Amazon EC2,4
Domain with failback IP,0
Run JavaScript after page load on WordPress using JQuery,1
Portable JDBC vs SQLite on Android,3
When not to use Kryo serialization in Spark?,1
Is it possible to get WPF to render low resolution fullscreen on a high res monitor?,1
How to run Microsoft Bot Framework on CentOS,3
"Access slow launch from .accdb, but not from within Access application",1
Unit Tests maintainability and factories,2
Sending a concatenated bytearray,5
detecting when data has changed,4
Consuming slow and synchronous APIs at scale,1
C# server scalability issue on linux,4
How to sum values of ranges faster,1
How to index mongodb collection to allow sorting/filtering on any of 10-15 properties?,1
Can't figure out which code design pattern to use,1
Material on modern (large) site architecture solutions,4
Changing history in Github,2
Security Impact of using strncmp()?,5
Google Security Command Center - relationship between ASSETS security marks vs FINDINGS security marks,5
excution time is too long msg in beginning and then the whole debugging stops,1
combination element in list with possible way is going over O(n^n) [duplicate],1
Compounded monthly growth rate calculation in tableau,1
Performance / capacity statistics for web2py?,4
Security issue ImpersonationToken + DbgUIremoteBreakin?,5
How GetProcessElevation implemented and Why it need TOKEN_ELEVATION_TYPE*,5
Is it safe to keep java ssl keyStorePassword/trustStorePassword in sh script?,5
Squid proxy configuration for client SSL termination,5
Django + Nginx + Gunicorn - Why is my TTFB so high?,1
Performance improvement in numpy array transformation,1
"Web Audio API Best Practice, simple synth, system optimisation / garbage collection",1
JS Prevent unsecured code from accessing the window object,5
*Client* scalability for large numbers of remote web service calls,4
ActiveMQ HA option with Shared File System,0
In-memory cache plus mutex in Google App Engine?,4
How could I correctly write PostgreSQL query for percentages?,1
How do I cluster ServiceMix?,0
How to improve this bottleneck calculation in Python (use of C++?),1
Liberty Server: isUserInRole always return false,5
How to read memory from format string exploit correctly,5
Which is more efficient ? A view created by java or a view in xml?,1
Azure AppInsights - Snapshot debugger - App Workspace data storage Solution,1
Embedded database for a simple portable application,3
"Maintaining releases/branches in an ""agile"" rhythm? [closed]",2
"Best way to measure query time in different DBMS (MySQL, SQlite, Postgres, MariaDB, Oracle)",1
GPS based wind speed calculation for radiosonde device,1
How to derive an AES 256 bit key from an arbitary byte array it Java?,5
How to scale a azure cloud service to reduce billing,4
Ruby VM concurrency and parallelism,4
Neo4j 2.0 HA webadmin errors out when doing query,0
How to create a self-contained service with microfrontends which needs to embed 100+ other microfrontends?,1
Why does linking with Direct X increase my program size so much?,3
Convert bytestring to array of uint8 Python,1
Could somebody recommend a book about development of portable C/C++ code? [duplicate],3
What is the relationship between security check in scope element in mfp?,5
Does the DLL Plugin do anything when using Webpack@5.x?,1
"Message queueing solution for internet-connected, distributed C# clients",4
SQL/SSIS 12h Performance issue only on one server,1
"Ansible sysctl tries to reload ipv6, even though ipv6 is disabled",5
ASP.NET Core 3.1 slow publish to FTP,1
Do applications still print() in release build for C#?,1
JAVA SOAP: roblem with signing SOAP message,5
Highly Available DB with consistent hashing P2P design,0
Is __extension__ keyword portable among all compilers?,3
Time Complexity of Printing a Graph in Adjacency List Representation,1
Mochiweb's Scalability Features,4
How to detect if the application being used by a user is mod apk or not,5
Why am I getting RuntimeError while using threading.Thread()?,1
Splitting Data Python,1
emailjs not sending email why?,1
// Q.Ihow we can add synchronously in node_obj.title in for loop,1
Ransomware vs Crypto malware,5
What are the implications of leaving an expired certificate in the Java certificate store?,5
Secure Video Streaming - Limit by IP or device,5
Multiplatform standalone Java application with JVM included,3
Availability set display issue - when placing a VM in a location different from the location of the availability set,0
Implementing adjective-to-noun conversion across a wide swatch of words,1
C# Multi-form coding practice [closed],2
Loop over complex array structures with best practice and lowest complexity,1
"""eventDateTime"": on Microsoft Graph Security API alerts response always comes with the same format?",5
Optimal method for the decoding a string encoded using the Fibonacci Code,1
Efficiently plot large coastline file with gnuplot,1
Iframe data loading issue,1
Buffer Overflow Attack doesn't work on Ubuntu 20.04,5
how to update cache only when data is changed?,4
How to improve the keyboard navigation performance,1
"Making cakephp 2 web secure not to be detected as ""less secure app"" by Google",5
Test Intel Extension for Pytorch(IPEX) in multiple-choice from huggingface / transformers,1
Passing shared_ptr in mediator design from one colleague object to other running in different threads,1
Preventing MSYS 'bash' from killing processes that trap ^C,3
how to make this function faster? [closed],1
Return Oriented Programming on ARM (64-bit),5
Checkpoint linprog,1
Why is my Python code faster than my C code?,1
Is there a security concern in RxJS library?,5
Default file extension of the executable created by g++ under Cygwin vs Linux,3
Efficient way to get top 5 rows with max value without using order by?,1
Is there any downside to using negative array indices in C?,1
C struct alignment and portability across compilers,3
numpy - efficient value counts in 2D and 3D arrays,1
"High volumes, long running. Life’s too short",1
"How to improve performance of a select statement, which calculates a running total",1
Is this way of handling POST and GET data a good practice?,4
Raku slow Mixes sorting,1
UILabel/NSTextView vs. CATextLayer,3
List of Lua commands/statements to watch out?,5
Portable java solution for zipping/unzipping,3
Nodejs rest endpoint as kafka producer - slow performance,1
mongoDB architecture for scalable read-heavy app (constant writes),4
MFA Support for Excel to Access the API,5
Are numpy arrays faster than lists? [closed],1
Docker-Compose with Nginx and PHP -> Nginx Config for Performance,1
Using OWASP ZAP (and tools of the same purpose) on AWS EC2,5
What is the advantage of using JavaFX for an android project instead of android UI itself other than portability of the code,3
Security issue with angular build dependent packages angular,5
Security Vulnerability XSS Dom based,5
Number of contextBridge in electron preload.js file,5
ZAP security testing in Mobile - unable to launch app or browser via connected wifi after changing Proxy to manual in mobile ( both android and IOS ),5
A faster way to have two random numbers that always divisible?,1
Denial Of Service Resource Exhaustion on request,5
Do the sites using password maximum limit store the passwords in plain text?,5
How can elusive 64-bit portability issues be detected?,3
Multiple schemas on multiple machines in postgres,4
Is it possible to portably define a function that accepts any number of arguments?,3
What is the right way to upgrade netty and its components for security reason?,5
__Secure cookies not being sent in fetch request,5
GPG keys vs ssh keys vs personal access tokens,5
PowerPoint: Fast text manipulation,1
Encoding and Set Password For a .Model File in python,5
Parallel file download,1
Recursive function fails in Java (ArrayList),1
Merge two separate react app into a single app,1
Portable Cocoa for Windows,3
Why doesn't my threaded .Net app scale linearly when allocating large amounts of memory?,4
upload files from work laptop without leaving a trace [closed],5
Is my code in C portable and endianness independent? [closed],3
Cause of closed connection,1
"What's the idiom for ""sizeof type T on my CUDA device(s)""?",3
AngularJS 1.2 support: Security patches and existing vulnerabilities,5
Nestjs-Safest way to store sensitive documents,5
"Z3's running time depends on `smt.qi.eager_threshold`, but the log is the same",1
How to recreate docker containers for single service synchronize?,0
asp.net core SignalR performance - send to each client vs send to all,1
Is it possible to create Portable VM?,3
Cloudinary+nuxt-picture and dynamic transformation,1
How can '/e' regex expression be misused on a PHP code snippet running on my server?,5
What kind of polling server pattern exists for Windows developers?,4
performance difference between declaring a variable inside a loop and outside the loop in C language,1
How to block R from accessing the internet using a firewall?,5
"Communication, High Availability and microservices",0
How to convert UTF-8 <-> UTF16 portable,3
Fast calculation of floating 1/N if factorization of very large integer N is known,1
What is an efficient way to implement a high-update-rate GUI with AppKit?,1
"HBase regions not fail over correctly, stuck in ""OPENING"" RIT",0
Performance UNION all & joins,1
Firestore - Reading docs with 11 counters inside transactions,4
Faster method to extract information from complex nested json in python dataframe,1
Load bundles from a separate SVN repository,2
"Electron, contextIsolation and contextBridge",5
Is it dangerous to store a password input in a state before sending it over a https post request? [duplicate],5
2FA - how to store login credentials correctly,5
Increasing code readability without a decrease in performance (for this snippet in C),1
Is System.Data.SqlTypes portable?,3
Subtitles colors are overlapping(intermixing) after changing in Exo Player Library android,1
numpy vectorizing a function slows it down?,1
Read file line by line and do regex replace,4
Single Auth model for SPA+API Server and Traditional Web Application (OIDC way),5
Calculating and improving the number of requests/concurrent users my webserver can handle?,4
Most secure way for web application user authentication,5
How to solve performance and hot reload issues in flutter?,1
does Django HttpResponseRedirect suffer from xss attack?,5
Scalability of Views in Android,4
Is it wise to use temporary tables?,4
How to prove my stakeholder and manager my software works? [closed],2
Scalability of multi-site rails app,4
Python: Print string in reverse,1
Creating standard user sid,5
JMeter test from Java Code - Generate Console/File Reports matching GUI Reports,1
Avoid scraping of duplicate / clone / master-slave targets in Prometheus?,0
FIFO inventory aging report using a single query in T-SQL,1
Access-Control-Allow-Origin: null got detected while I've set value in Nginx and Tomcat,5
Postgres data base need suggestion creating an index for table,1
log4j vulnerability with avro-tools-1.9.1.jar,5
cron job or task scheduling in portable standard,3
Performance of linked list compared to std::vector of pointer to objects,1
Scaling a rails database queue system,4
Why does the second call of the same function execute forever?,1
Match request URL params with rails routes via recognize_path,5
Security of AWS configuration details with environment.ts file,5
how to detect if any web extensions are being used [closed],5
opencti VM credentials,5
Performance Improvements of CIFilter Chain?,1
how this website is hiding all in inspect elements?,5
How to bypass the login page for an outdated open source project that utilized OpenID?,5
WCF - How to use a custom System.ServiceModel.Security.SecurityAlgorithmSuite with a custom binding,5
How to scale psycopg2 insert and select with single process in python?,4
I am facing issue with IBM API connect when I configure the API connect using static IP address,0
Why doesn't google.com use CSP?,5
Improving Redis Lua script performance,1
Are there any tools like Google Lighthouse that can help audit mobile app pages(not web pages),1
Portable way to implement variadic arguments in kernel space?,3
How to determine C code is compiled for Android/NDK or iOS,3
Map IP Addresses to cities,1
How to manage OAuth flow in mobile application with server,5
How should a Firebase Firestore database be structured to efficiently store grouped data?,1
Best practice for logging in case of unauthorised user,5
Does AutoSproc Scale Well?,4
How can I restrict which desktop applications can send data to my server?,5
i want get token Oauth2 by postman,5
Overloaded AKS API server because Flink on Ververica is not respecting provided high-availability configurations,0
Page within iframe not seeing its own cookies,5
Sumif function between 2 dataframes,1
"Groupby, Split, and Count Combinations (removing loop for pytorch performance)",1
How would I make a backend for my Electron app,5
ADO.NET and SQLite single cell select performance,1
Waiting long time in execution of loop when using dynamic schedule,1
When does security becomes critical with CodeIgniter?,5
Is there a way to parallelise time.Sleep but keeping the effective execution time in Go?,1
Run Airflow HA Scheduler as systemd services,0
NoSQL / Redis Scaling Theory,4
What is the relationship between Safari and SSL certificates?,5
Get the performance of an embedded iFrame in Angular,1
