RequirementText,class
question / answer authentication require a server encryption [closed],5
How to add a filter in django for every request?,5
Is it possible to sniff a running python code?,5
MOSS 2007 - Maximum number of views for one list?,4
"Content downloading(CSS, JS etc) taking too much time which making loading too slow",1
Prevent my React / Gatsby contact form from being hijacked,5
How do you access environment variable values without os?,5
"Is it possible to replicate Node.js scalability feature with single event thread, event loop and callback mechanism?",4
Find indices for elements in array B best matching those in array A,1
People trying SQL Injection attacks on our servers,5
Python authorization flow for oauth,5
Time complexity analysis of two algorithms contradicts empirical results,1
Android Work manager get triggered everytime I open my app,1
"How to speed up a simple UPDATE of all values in one column, in MySQL",1
find the intersection of elements of powerset one by one,1
How to achieve Tensorflow Python model() (__call__) performance in C(++) API for small inputs?,1
Am I impacted by this Google Drive API change? [duplicate],5
Respond only if a request is made from a specific address [closed],5
Is there a way to create a masking policy accessible across all databases and schemas in Snowflake?,5
Proper shebang for Python script,3
Most efficient way to get average by object property (array of Objects) [duplicate],1
Jfrog Artifactory Highly Available Setup in Kubernetes,0
Redis creating keys efficiently,0
How secure sensitive data in react-native app,5
How to associate registry with scope in Yarn 2 without breaking auth?,5
"Spring security's CSRF token - can I use pure HTML, or do I need JSP?",5
How to restrict launching activities from command line,5
Faster alternative to R car::Anova for sum of square crossproduct matrix calculation for subsets of predictors,1
Elasticsearch configuration file with sensitive data,5
How to verify key generated by App Attest?,5
Convert single-column txt with 300 million rows to NumPy array faster,1
Service architecture using technologies which provide parallelism and high scalability,4
"How to check if Update KB4474419 (SHA2 support) is installed in old Windows machine, and install it in the background if its not?",5
What the simplest portable way to block a thread 'forever'?,3
Controller returning login form while returning file with Symfony 5,5
How to fix checkov failed item by its rules?,5
How to portably obtain the offset in bytes from the beginning of an istream?,3
Are the event ratios in Appendix B.8 of Intel's Optimization Reference Manual applicable to other microarchitectures?,1
Correct format specifiers for custom integer types in C to ensure portability,3
scalable file upload/download permissions,4
Extendable accessing of sqlite database on android platform,2
Why is it wrong to have cacheable https response?,5
How can I set limit on the amount of storage that each user can upload to Firebase Storage?,5
Why is KNN so much faster with cosine distance than Euclidean distance?,1
Speed up embedded linux compilation process,1
How to monitor get/post endpoints on aws api gateway?,0
Most elegant way to store duplicate String elements with increasing counter at the end of every duplicated element,1
How do I encrypt text correctly using AES 256 GCM mode in Java? [duplicate],5
Docker Swarm failover behavior seems a bit underwhelming,0
How to set private IP address name to a generic name to show to user?,5
Limit access to GCP Cloud Function based on domain rather than IAM,5
PayPal API Taking Very Long Time To Respond,1
How to simulate high traffic load on a web application? [closed],4
SSD - Single large disk read vs many small disk reads,1
Hiding passwords in python file,5
Suggestions for a scalable architecture solution to large data problem,4
What platforms offer SystemRandom?,3
content security policy frame-ancestors,5
Keeping track of a field's values distribution without scanning the collection / table,1
loading loose XAML drawing securely,5
How to elevate account on start / install with standard user?,5
Mongoose nodejs : find() and populate() calls,1
What is Set-PSRepository scope effect?,5
Which database should I choose?,0
Responsive Audio Player,1
Does the order of if-conditions inside a loop influence execution speed?,1
numpy argsort slow performance,1
Random sample in numba,1
Azure Default Reader vs Built-in Monitoring Reader,5
Why JFR skips event fields,1
Is it a good programming practice to exchange plain text passwords between local microservices?,5
Strategies for reducing ViewState size in asp.net,4
Why threads are dropped off from jmeter test?,1
Is writing unions content to file safe,3
ASP.NET Core EF Performance loss due to migration?,1
Best approach to provide SQLITE Encryption Password in vb.net code,5
Query grows slower as user activity increases,1
Calculating similarity measure between millions of documents,4
How to calculate the outer sum (not product) between 2 (1D) vectors,1
"Can ""Dylib Hijacking"" really happen on iOS app?",5
What makes Perl code maintainable?,2
Isn't it a bad idea to store your service account key in the code? Firestore documentation is saying I should [duplicate],5
Is loading queries from disk without application level caching extremely inefficient?,1
Neo4j HA cluster in AWS,0
Difference between akamai and cloudflare,4
Django or pylon portability to python 3 will affect my app?,3
An algorithm using Dijkstra to calculate,1
R Alternatives to a for loop for searching through a large dataset,1
Default byte order of QDataStream,1
maintaining dynamic consistency level in datastax,0
High Availability on Glassfish,0
Improving performance of loop by using different list types,1
Selecting such vector elements so that the sum of elements is exactly equal to the specified value,1
Webcam input sent through OpenCV to pyvirtualcam results in slow frame rate (Mac),1
React - tool that can help me monitor problematic parts in terms of code execution time in a component [duplicate],1
How to write a portable program in python that accesses particular directories?,3
Java JPA enum-like String options,5
How to properly deploy the kafka monitoring agent?,1
Is receipt verification required every time a user wants to access purchased product?,5
How can I disable Swift playground live view window,1
How to secure Azure Translation API key in Android App,5
Loading process getting delay when load any page in android webview,1
ramp up step count and ramp up time in concurrency thread group,1
iOS force thermal throttling,1
What are the downsides of replacing all integers with doubles?,1
Allow only one application to connect to wcf service,5
PHP Script Performance Invariable to Different Processors/Builds,1
"std::accumulate vs for loop, raytracing application",1
How to achieve a secure system BroadcastReceiver,5
Does elasticsearch 7.3 rest client discover new nodes?,0
Validate if string has only numbers,1
Avoid multiple executions of a function in different instances,1
Increase speed of function that reads a string,1
Nexus Repository Manager OSS - High Availability - Clustering (HA-C) or Disaster Recovery,0
How can I measure Blazor server render performance?,1
"Why is the CMake solution for ""R_X86_64_32 can not be used when making a shared object"" specific to x86_64?",3
How detect Cheat Engine?,5
Applying a missing value distribution of a Dataframe to a subset of the Dataframe: Needs to be faster,1
Speeding up the zoom and zoom function of the map drawn with Javascript canvas,1
"Implementing a real time counter using spring and either hibernate or AtomicInteger, best way?",4
Punycode occupies two email addresses if used for user registration,5
How should a VPC be designed when using a service mesh?,5
Aurora postgres Can I create a partial GIN index on a JSONB column,1
file required for ffmpeg portability,3
Kotlin - checking Instant in range compared to using start >= Instant && Instant <= end,1
When to use vector clock for distributed system?,1
React Native Looping Animation Performance,1
invalid memory address or nil pointer dereference?,5
How to run zend framework project on portable wamp or xampp?,3
Iterative steps / best practices for transitioning RDBMS to Cassandra,4
Redis elasticache in aws - how to get persistence and keep good latency,1
How would I ensure of a emergency recovery method of root account is possible in GCP?,5
PostgreSQL slow query over ranked,1
Is it better to compress every line individually or compress an entire file?,1
"How to reduce ""Unused Vcore seconds"" in spark job?",1
How will many Firestore onSnapshot methods affect the performance?,1
Sharding of images / distrubuting on multiple Server,4
Performance of Oriented Object Programming in C++ on RPi,1
Convert image to a fixed format for throwing away all the extra annotations,5
Shared IP in CoreOS,0
SQL a Function under Select make it very Slow,1
How can I trigger a css animation multiple times using javascript and react in an optimal way?,1
How does bundle size affects performance?,1
How do you rewrite/recode a website to be scalable? [closed],4
How to draw only what is visible on-screen with gtk-cairo,1
SQL Performance for Querying 3-tiered Table,1
Hashmap slower than string.find?,1
High Availability VM Azure,0
What are some effective ways to pass variables between machines?,4
AWS Elasticsearch performance issue,1
Safeguarding node passwords,5
Slow query performance in MySQL,1
How does Elasticseach's model translate into these High-Availability patterns?,0
Android Vulnerability Exported activity=true,5
how to get rid of infected Android device by malicious virus? [closed],5
"High availability computing: How to deal with a non-returning system call, without risking false positives?",0
Is there a scalable email service similar to Amazon's AWS for storage? [closed],4
How can I get stackwalk information by EnableTraceEx2,1
Random cookies are getting generated in ASP.NET MVC,5
How to protect login form from being proxied and used in phishing attack?,5
"sequence of features implementation on a large scale website,",4
Scala Akka Fault Tolerance/Supervision not working,6
Protocol buffers and UTF-8,3
Vuex state management Vs Vue simple state management [closed],5
Rails ActiveRecord Table Indexes - When should they be used?,4
do efficiently floor function on all item's in std::vector,1
How do I programmatically check memory use in a fairly portable way? (C/C++),3
Using GNU C Libraries and other Data structure libraries on Mac/Windows/Linux.?,3
Azure AKS - splitting node pool over multiple Availability Zones,0
Ideal database class for maximum efficiency in python?,1
Performance of numba (did I do something wrong?),1
How to query keycloak resource permission with a token issued from a public client,5
How Long Do Programming Operations Take?,1
Avoiding Vendor-Lock-in: Is code written for Windows Azure completely portable to self-hosted IIS/ASP.NET?,3
PHP Sanitise $_SERVER['REQUEST_URI'] with a Global Find and Replace How safe is it?,5
How to calculate the Big 0 of a recursive function cycle of multiple methods?,1
How should I add my rule file to Suricata?,5
How do I ensure what a remote server is delivering in fact is genuine,5
WCF Client scalability advice,4
Is a forever while loop bad for scalable program?,4
log4j performance on huge treatment batch (10-12h),1
How do I perform a complex SQL-Where operation affecting two tables in pandas?,1
Check for duplicate input items in a data-intensive application,1
Is there a way to extract a specific repository's security advisories from GitHub security advisories database using GraphQL?,5
What is the point of sending timestamp?,5
How to determine integer types that are twice the width as `int` and `unsigned`?,3
Scalability and high availability of a Java standalone application,4
Spring unauthorized request despite having .permitAll(),5
How to get path directories list in portable way in Matlab?,3
"""match"" compiles into suboptimal asm compared to ""if/else""",1
Scaling a postgres server to multiple servers,4
TLS 1.3 support for .Net 4.0,5
How do you structure your reusable libraries?,3
How can I block the javascript function use CSP?,5
How do i include different headers based on my OS?,3
How to hide part of react.js application from authorized user?,5
Does the Thundering Herd Problem exist on Linux anymore?,4
How to reduce Query execution time for Optimization?,1
"What's the most secure way, to combine ""openssl_encrypt"" and ""hash_hmac"" to encrypt data?",5
Angular msal.js secure public API,5
How portable/compatible is JBossWS-CXF?,3
git: Setting anyone's email address in .gitconfig,5
server web with redundant mariaDB databases,0
Is .isin() faster than .query(),1
Maximum number of compares to reach a search hit in a hash table with linear probing with special condition,1
Does RAND() has low entropy to generate salts?,5
How to block all traffic to pods matching a label using a NetworkPolicy,5
Fix openRedirect using ESAPI sendRedirect but not working in Java?,5
Maintainability Index,2
How to include function names for dll project in performance profiler for visual studio (2019),1
Android poor graphics performance,1
scaleable cloud computing services [closed],4
Content-Security-Policy violation reported on allowed image,5
Does MPI support only broadcasting?,1
PHP Replicated Database Sessions Failover,0
How can I make SocketIO more performant?,1
How portable is the use of getch outside curses mode?,3
How to Guarantee Message delivery with Celery?,0
Can I use the access token directly from FB.login on my server?,5
Jumpy behavior while creating sticky header using css transform,1
How to find the total number of operations in a MongoDB cluster?,1
How do I securely request js file from a known url in javascript,5
node-rsa: Don't Need to Import Public Key?,5
my code for sha256 algorithm in python doesn't except length of above 56 characters (448 bits),5
What is the proper way to query MongoDB matching $in with large collection?,1
How to protect data written in my application like a password,5
How to control over outgoing static content,5
How safe are extensions in Visual Studio code?,5
Slow server caused by mongodb instance,0
How do I translate Prolog's cuts to Curry?,1
Better way to add column values combinations to data frame in PySpark,1
What hash (Python 3 hashlib) yields a portable hash of file contents?,3
Multiprocess to compare strings in multi .txt files?,1
Optimize function to order a two-dimensional array by the value of its position 0 in C,1
How should I structure this data in my database?,2
Powershell Printing Custom per Printer Permissions,5
Where should computations take place for complex algorithms,4
internal create-md' terminated with exit code 20 - DRBD,0
Xamarin.iOS binding library cannot use the SecKey API from the Security framework,5
How to improve Django-PostgreSQL search performance and increase HTML rendering or AJAX response speed?,1
How to make a mail sender application approved as secure by Gmail? [duplicate],5
Performance issues on WSL 2,1
Efficient way to get a k-subset from a list of numbers in which numbers are at least d apart?,1
How to search a CLSID in windows component services?,5
Kubernetes change multi-master node to single master node on failure,0
Data structure for multiple disjoint regions on a 2D Grid,1
k8s tasks slowdown with no excess CPU or RAM usage,1
Optimising Google Speed Insights API Script in Google Sheets,1
ef core slow Initialization of DbContext on a small datamodel,1
Performance of ArrayBlockingQueue and SubmissionPublisher,1
Should you use webhooks in an enterprise on-prem application?,5
Multithreading slows down main thread,1
AWS Waf: Allow your own domain in AWSManagedRulesCommonRuleSet#GenericRFI_BODY,5
Best practices for writing to memsql using Spark,4
Pacemaker - High availability cluster - how to receive notification,0
"Julia takes abnormally long to start up, and to run files",1
Vectorization of stemming/lemmatization operation on pandas data frame,1
Doing calculations in MySQL vs PHP,2
Is it normal for dependencies to be duplicated in angular's source map explorer?,1
How can I rename master nodes in a HA kubernetes cluster?,0
"how to ""broadcast"" np.searchsorted [duplicate]",1
Docker redis unauthorised access,5
R for loop wise : Rowwise sum on conditions : Performance issue,1
"Database Encryption Basics: When using MongoDB Atlas, are data automatically encrypted?",5
Is there a performance advantage in using AnimationTimer over just using self made threads?,1
Writing Maintainable Event-Driven Code [closed],2
Is limitation of accessibility for classes and their members a valid practice for more secure code?,5
Horrible performance on Azure App Service - Wordpress,1
Custom Neo4j High Availability,0
Why is C++ much faster than Python here? [closed],1
Group numpy array elements without for-loop,1
python pandas data frame: assign function return tuple to two columns of a data frame,1
Developing a scalable Twitter data adaptor,4
How to index monotonically increasing data in a table?,4
spring security basic Authentication Password not taking #,5
JVM failure - fail over,0
File path exist always return false Android Above Q,1
High memory usage in React Native FlatList,1
Symfony: Retrieve user from a different firewall than the firewall being used in the current request,5
How to secure a dockerized python contiainer [duplicate],5
Why is pam_faildelay.so not taking effect if user clicks cancel button?,5
Which one is more efficient - For loop VS if statement,1
SSD read performance,1
Determine Number of Supported Users for a Web Application,4
Making iframes from some domains invisible,5
Achieve high availability and failover in Artemis Cluster with shared-store HA policy through JGroups protocol,0
What is the time complexity of my solutions?,1
Performance consideration while converting hql script to spark,1
How to use linux perf to profile kernel modules and it's functions?,1
RabbitMQ queue-master-locator does not work when stoping one node,0
Is there a need to encrypt information that's otherwise public?,5
Optimizing LINQ find query,1
Erlang list-argument memory usage (efficiency & performance),1
Scaling an application on a client by client basis?,4
What is the fastest way to get a hash of a collection [closed],1
Working out the time complexity of this code,1
"Jenkins - ""docker login"" on staging server with jenkins credential",5
Is it possible to check whether a browser is fast by JavaScript in a simple way?,1
Read and write directly from and to compressed files in C,3
Is it necessary to encrypt client side activated Firebase Function Data?,5
IDX10632: SymmetricSecurityKey.GetKeyedHashAlgorithm( 'HS512' ) threw an exception when validating JWT using HS512 ALGO,5
"Python (Portable 2.5) subprocess report problem ""WindowsError: [Error 3] The system cannot find the path specified""",3
how to limit access to my iframe widget using CSP cookies and http referer,5
Override TSQL query to another,1
Application with auto update and MongoDB replica set,0
Is there a way to improve performance of adding unsigned long long to unsigned int [closed],1
How to use Lag value of a column in condition to populate another column in Pandas,1
How can I make sure I fully secured my AWS S3 Bucket?,5
Which set of instructions has better performance?,1
Replace values in a string without looping thru each row,1
Git worktree performance impact,1
A looping script gets slower with time. How can I improve this?,1
How does 0-1 knapsack have mathmatically exponential time complexty?,1
How to do lookup using VBA for values quicker in massive data,1
CPython and PyPy Decimal operation performance,1
How to avoid response maniputaion for OTP verification,5
Xerces-c and cross-platform string literals,3
ECDSA Algorithms not available in Java with jlink,5
How to ensure that the user cannot log in from another device or browser that is not defined?,5
python: OpenCV Root Directory,3
How to add fault tolerance support to an existing MPI based system such that the system continues even after a machine goes down?,6
More optimized math function using NumPy,1
mysql scaling on Kubernetes,0
Why does using the time module with tkinter make the app lag so much when going into a new function?,1
Fonts and their sizes on different machines,4
Portable security role mapping with jdbc realms,3
Why Ordinary Least Square (OLS) method has worse performance and scalability than Gradient Descent (GD) in simple linear regression?,1
RethinkDB Replica Sets and Shards for HA,0
How portable is GLib?,3
Cluster node fails to start,0
How can I customize the Cryptographic Service Provider (Base CSP) in the Smart card subsystem architecture,5
Is there a quicker method for iterating over rows in Python to calculate a feature?,1
How EF should be used in a scaled application?,4
SQLite or MySQL for a read-mostly website?,4
How to check if a process has access to a securable object in windows,5
is there any way for extracting audio features and save faster than this torch code?,1
How can I maintain an iOS Framework initially installed via CocoaPods but modified manually later on?,2
Cannot modify Process DACL that I own with my code but Process Hacker can,5
How to replicate session in memory on Oracle Weblogic?,0
Database structure - Single design table with category_id (Many rows) or Multiple design category tables (Few rows),4
Declare type of struct field to be the same type as the struct itself in Julia,1
Failover solution for Email Service Providers (ESPs)? [closed],6
Fastest method for calculating index of element changes in Python list,1
How to process pandas faster (output of first row input for another),1
Highly scalable db schema for recurring events,4
Drag without lag in Android Java,1
Detect if credit card is from the US,5
"in the sake of increasing code performance... ESLint is reporting ""Arrow function has a complexity of 21. Maximum allowed is 20""",1
Qt GUI non responsive on Windows XP,3
Scalability of Oracle Forms,4
How to optimize insert from select in For loop in Oracle PL/SQL,1
How to make designer generated .Net application settings portable,3
SQL Server memory reaches 100% & then stops responding?,1
How To Detect Array Entry Deletion Request In Firestore Rules,5
Ensure regular expression is performant and secure,5
Nudity detection in python,1
LiteDb performance and limitation for production high data volume,1
Firebase Scalability,4
3D array of Strings calling handles/hooks,1
Using ssh keys from Vault to ssh via Jenkins Pipeline,5
How to secure Android application,5
vmap ops.index_update in Jax,1
Checklist: When to write portable / POSIX-compliant shell code?,3
Python XGBoost GPU version underperforming accuracy of CPU version - parameters tuning,1
Fastest way to populate an existing array,1
Page becomes unreponsive when size of select2 dropdown options increases more than 25000,1
Slow Postgres Query with a SELECT DISTINCT and a Join,1
How can I make Gherkin scenarios for automated scalability test?,4
GIN trigram index not used when case-insensitive query is performed,1
Writing files with Flatworm in Unix System,3
How to reliably shard data across multiple servers,4
Why is Heap sort efficient?,1
Is it safe to store the oauth2 token in the UserProperties?,5
Most efficient way to do an Update Set query,1
do I need to remove previously loaded videos to protect page performances?,1
Is there a portable Perl? [closed],3
Do we need PBFT algorithm support in permissioned Block chain networks?,6
Anyway to use someone else's neovim/vim keybindings config on VS Code,1
Find 3 numbers that are sum up to a given number,1
"What would be better architecture out of these, to scale a system?",4
Why do these minor changes to f# linear algebra functions make them so much more performant?,1
GKE Cluster Audit,5
CMake Roundtrip Workflow,3
How to measure widget/component performance using Perfume.js,1
Test availability of a set of nodes in a single loop approach,0
Wildfly 15 configuration for HA on EC2 using AWS_PING,0
How to better handle scheduled maintenance in Google App Engine from HK/Pacific timezone?,0
What specifically makes Node.js more scalable than Apache?,4
javaFX2 miglayout portability,3
istream and ostream across platforms,3
I want to reduce Internet Speed while opening my Own App for testing purpose?,1
Why is rsync so slow with huge files containing a lot of changes?,1
"Recommended ways to produce app portable between Android and ""other platforms""",3
Recommended strategies for using Github PATs on RPi [closed],5
Whitesource bolt and Azure Devops,5
Storing user and pass in SQL Server to be used by Python application,5
Scanner reports security flaw in netty-handler-4.1.65.Final,5
Error Connecting to SQL Server High Availability Cluster using Azure On-Premise Gateway,0
What is the most efficient to run certain lines of code only when a boolean is true?,2
How does RabbitMQ decide when it is time to delete a message?,0
Unexpected performance in Numpy from multiplying by 1,1
Initialising SSLContext in case of multiple threads,5
Efficient exponentiation with division,1
How can I avoid a join in SQL and still relate values across tables,1
Performance Improvements in Haskell,1
SHA1 Algorithm in FileInfor properties of .Net Project EXE,5
OpenGL: Is aliasing a predictable and consistent phenomena?,3
scraping api protected by impreva,5
"win performance monitor: monitor service by using ""command line"" instead of ""name""",1
Laravel 5.6 Query Builder nested sub queries,1
Why is my query uses filtering instead of index cond when I use an `OR` condition?,1
CosmosDB - Gremlin - high memory usagage with query containing limit() step,1
plot speed up curve vs number of OpenMP threads - scalability?,4
Meteor Security Permissions on Uploaded Images,5
