RequirementText,class
Antiforgery Token in Angular 9 front end and ASP.NET Core 3.1 API backend,5
Jmeter ca and client side certificates,1
"Always being available, any thoughts?",0
Is JMeter Dashboard not able to create chart with small users?,1
Improving performance for huge table. Partition? Dropping an id and keeping a unique constraint instead? mysql,1
C Code slower on Windows than on Linux,3
Can std::chrono::system_clock::now() throw an exception?,3
Performance of setTimeout in node?,4
Postgresql OVERLAPS performance on big datasets,1
Caching of constants in OPA?,1
How can I store 1 billion images on servers uploaded from a web application? [closed],4
Problem with elapsed time using MPI_Wtime,1
How to handle upwards of a million concurrent clients on a single Java server?,4
Qt portable project folder,3
Refresh Token Rotation - is it really enough?,5
How to make turtles / agents go faster or slower when being on a certain patch?,1
Is it safe to store senstive data in memory,5
Fastest way to remove duplicates in a list using each entries instance variables,1
Is ANSI cursor indexing portable,3
Building a unique ID without collisions,4
Reproducibility of java pseudo-random numbers across systems and versions?,3
Is there any way to prevent useless renders?,1
Understanding the performance of a web application made in Angular,1
how to dynamic download and use self-signed CA in networkSecurityConfig at runtime when develop android release app,5
How to fix a request denied as a potential CSRF attack in java web app?,5
Flask-SqlAlchemy insert extremely slow after load large amount of data,1
Is It Safe To Login Once Then Set The JWT On axios?,5
Why is the request to the JS executed 2 times longer than the api responds?,1
Show top 10 scores for a game using DynamoDB,4
C macro/#define indentation?,3
Unlink non-logged on account from Microsoft in Windows 10,5
Facebook integrates itself on my users' phones violating Content-Security-Policy,5
gcc size of types,3
Getting invalid count in ZAP reports alerts,5
Variable stack size on stack overflow exception [duplicate],5
How to optimize HTTP API?,4
Security of devices who implement Face Unlock on Android 10,5
Security in in-game NFT mint,5
Problems with HAProxy 503 Service Unavailable,0
Draw random element from small intersection of two large lists fast,1
Should I use a constructor when size is known,1
Android network security configuration not working,5
Node authentication with access and refresh tokens using Passport,5
Login error in python with smtplib library,5
Material-ui TreeView Performance (avoiding rerenders of unchanged subtrees),1
Can linode make django deployment simple?,4
Is it safe to pass csrf_token directly to ajax post data?,5
How to get mean and std from a dictionary of dataframe per each key,1
How to properly handle asynchronous database replication?,4
Script to remove multiple databases from HA,0
How to handle a huge dataset [closed],1
Multiple service connections vs internal routing in MMO,4
Service account with org viewer role not able to perform any actions,5
ReactJS: Looking to improve my dynamic fields building component,1
secure boot and flash encryption on esp32 using esp-idf,5
How to find the source of unknown script includes in header?,5
What certificate is needed to connect to firebaseio.com?,5
What is most recommended solutions to avoid dos attack for financial websites?,5
"Issue with Chrome and Angular 8 Application when i print a component, Takes too much time load Print Preview",1
How can I send message from one node to multiple nodes in OMNET++?,1
Simplest solution for high availability of SQL server 2008?,0
How to find the Return Address when performing a Buffer Overflow Attack,5
Sharing sockets over separate nodeJS instances,4
Security best practices for mysqli connection in PHP [duplicate],5
golang - image file validation,5
Why does order of function calls impact runtime,1
Securely remove string content from memory [duplicate],5
How to avoid double processing of data on a busy site?,4
Firebase Scalability Limit,4
How do you measure inference speed in object detection?,1
Y86 Architecture Immediate VS Register Arithmetic Efficiency Question,1
Searching numerous very large (50GB+) txt files for text matching [closed],1
MPI_Bcast into a while loop,1
Imagemagick convert ultra slow,1
Performance on a node.js app and mongo DB database,1
Is manualy updating JWT access_token data considered a bad practice?,5
What is the best practice to expand GCE root persistent disk size of the running instance,4
How to unpacking effectively Monte Carlo simulations in Python leveraging from numba? SOLVED,1
How to implement multiple auth provider for single user,5
How does event driven I/O allow multiprocessing?,4
what of encryption protocol aws uses in transit within AWS resources?,5
Emails sent from Server1 reaches the destination from Server 2,0
"c# databases for wp7, pc and xbox",3
No server certificate trust in Azure SQL Database,5
"Implement ""following"" feature efficiently on GAE",4
Solidity block.timestamp vulnerability,5
Fastest way to store and obtain data in PHP,1
Intune - know about the VPP location and license count info in Intune,5
Wordpress Theme Invalid argument supplied for foreach(),1
"Trying to connect metasploit to database, username is nowhere to be found",5
"Hadoop 2.0 Name Node, Secondary Node and Checkpoint node for High Availability",0
node.js image upload best approach,4
Python - how to avoid getting full data from Firebase?,5
temperary shared parallelism (OMP) within distributed environment (MPI),1
How to Optomize Android Activity with 50k+ code lines,1
Portability of pthread and socket.h,3
"Reducing time complexity for Python, finding numbers with same digits",1
Filtering list on multiple conditions,1
Google Security Command Center - how to export findings in JSON format,5
How to make a console c++ text game that uses pdCurses portable,3
How to understand checkpoint in Flink correctly,6
"Why is the Performance score of an empty, default NextJS Application so low?",1
accurate data from lower time frame in pinescript,5
How To Use A Relative Path For The Eclipse Workspace,3
What CSP is safer - style-src 'none' or style-src 'unsafe-inline',5
Best service architecture to listen for requests in queue (queue based load leveling)?,4
How to generate a large (30MB+) xml file in java?,4
PPP demand dial with modem bank in linux [closed],4
Mariadb thread stuck with status 'reset for next command',1
How to reduce or remove the delay on starting an Android activity from button click,1
Scalability of reactive programming,4
"Free, portable, all included, all in one, php Apache based server? [closed]",3
Load Balancing by a server as heavily loaded as google,4
Application based on .Net Framework Allowing all CORS Origins,5
X500DistinguishedName with UID field,5
R function with ggplot and ggsave saves empty file,1
Firebase database keep secured from apk decompile and use [duplicate],5
mixing openssl API and BSD sockets API,3
Issue related to the usage of the library Chart.js,1
MQTT backend scaling,4
Redis master/slave replication - single point of failure?,0
Performance analysis Groovy vs Java,1
What does it mean scalable/modular code in web development?,4
Coverage tool showing unused javascript for Google tag Manager how to solve this issue,1
Being informed of new exploits [closed],5
How to scale a nodejs app,4
Do I need Backend-for-Frontend if I am using a framework like Angular,5
Is it a good idea to use github for private projects?,5
Logging the kernel Ftrace point selectively for particular arguments,1
Document Based Storage of Relational Data,4
PyTest: One test to contact more then one device,4
"What are performant, scalable ways to resolve links from http://bit.ly [closed]",4
Scheduled Talend jobs randomly go to sleep for 45 minutes while doing nothing (JDK 1.8 Talend v6),1
what is the portable equivalent to linux`s signal.siginterrupt in python?,3
How do you safely deploy api keys/secrets in python programs?,5
PHP mail() function and scalability,4
what are the best toolkits and technologies that are available for building a scalable datastore?,4
Persisting Akka state in case of a crash,6
TortoiseGit FDCC/USGCB compatibility and security vulnerabilities,5
What is a scalable process of Project Management in Small Development Firms? [closed],4
Firefox is choking on a BASE64 image DataURI,1
mysql 5.6.40 and max_cache_size when You have a lot of RAM,1
Log4j2 Vulnarability in version 2.16.0,5
"Assuming a Linux box has a huge disk cache, is it significantly beneficial to performance for applications to buffer writes?",1
Horizontal scaling: routing user-generated subdomains between servers,4
Detecting and recovering failed H2 cluster nodes,0
Enterprise Wide Cluster Streaming System,6
Angular against XSS,5
What is the difference between Enhanced Strong Name (SNK) and Personal Exchange Format (PFX) and when should each be used?,5
"A subcase of byzantine agreement (4 processes, the commander is a traitor)",6
Google Cloud Spanner - technical implication of 3 node recommendation in production,0
What can be improved with this SHOWPLAN?,1
Where does Redis store the data,4
"Is ""SH512"" secure if using RSA?",5
Why/How too much logs impacts my application's performance?,1
Does Mono support visual basic (not .NET)?,3
Database selection for performance and scalability for C# APIs,4
"What happens in cpu cache when sequentially iterating over an array 1, and randomly accessing another array 2 for each element 1?",1
Improving list initialization for n-elements using nested lists,1
track firebase db/webapp/server url,5
how can I scrapd email addresses from webpage with bash with wget?,5
Different scenarios of scalability,4
Length of the intersections between a list an list of list,1
POST request receive large data in plain/text format in spring boot,1
"Make cgi-scripts ""portable""",3
How to apply a security patch to an existing docker image?,5
Excel VBA Workbook.Save Method taking >1 minute for changes on only 1 of 3 worksheets,1
Authenticating end users in a first-party native app,5
How to store a symmetric key inside AndroidKeyStore?,5
Verifying if the file is downloaded from the trusted source,5
Trivy and Dependency-Check report different vulnerabilities,5
Check for maven artefact vulnerability,5
Whats wrong with my CSP? Content Security Policy (CSP) implemented unsafely,5
Why should I not #include <bits/stdc++.h>?,3
how to enhance & increase performance to recyclerView adapter,1
"Can you develop an independent, secure oracle for your dApp?",5
"Large MILP with best bound = objective value at every node of B&B, why doesn't solver accept the solution?",1
MYSQL HA on kubernetes (vmware),0
Fast dfs implementation with python,1
How to use perf (or any other tool) to find out the execution time of an application function,1
Can a user somehow change the state of a React component from console in the browser?,5
Can using a math interpreter be potentially dangerous? [closed],5
"Load Balancing using nginx , fail over network issue",0
WebSphere SIB vs MQ ? what is the best option to go for asynchronous messaging from within a J2EE application running on WebSphere?,4
SubResource Integrity for dynamic changing Javascript files?,5
Extra Sanitisation When Dealing With Fetched Data,5
How do I efficiently find pairs of strings in a list with low (Damerau-)Levenshtein distance? [closed],1
USB Key web server with protected php scripts,3
surfshark-api dialogue automation slow with expect script,1
Visual Studio Code Metrics and the Maintainability index of switch case,2
Where should I store PEM file for my web app,5
How to count coincidences on each character of two large strings without triggering the Out of Local Stack exception?,1
Login when using OpenID for First Party authentication,5
Comparison complexity from left to right [duplicate],1
Portable lightweight C++ sockets wrapper,3
How to cut down on run-time for finding dimensions of a sphere Python?,1
"Does firestore's fast performance remain fast in all cases, even if there are millions of subscribers to the application?",1
What triggers cross-domain violation when AJAX request?,5
Why is struct of arrays not vastly faster than array of structs in Javascript?,1
Can I get the size of a dynamicly allocated array the way `delete[]` does?,3
How to optimise cost when architecting for high availability in a single region Multi AZ set up in AWS?,0
K6 script failing in azure devops,1
Netty High Availability Cluster,0
Found File on Server. What does this PHP Snippet do?,5
MySQL vs MSSQL INSERTs speed test,1
Compiling the Cuba library,1
Packer security group query,5
Implementing a web application gateway forwarding requests to customer site,5
How to render only subchild without rendering all high level component,1
Can Java Applets be dangerous? [closed],5
Boost Graph Library overhead,1
".htaccess show indexes, grant file access only with login",5
Are Node.js Buffers as JSON a portable storage format?,3
How to redirect jenkins.security.SecurityListener logs to a log file on a linux host,5
How do you safely identify a user contacting our API via an intermediary platform?,5
which of these structure is better?,1
Memory consumption for Tesseract OCR: allocate and deallocate for each use?,1
Current implementations of redis HA / cluster for a production environment,0
How to monitor TRANSACTIONAL_ID in use by kafka clients?,5
Android 12: How to test Performance Class?,1
script-src-elem is blocked athough being defined in script-src in Windows 10 (Chrome),5
Portable way to put stdout in binary mode,3
Does bitwise inclusive OR with assignment operator have advantages over typical assignment in java?,1
Load balancer on Bind level with websocket support?,4
How to chnage FirstOrDefault to Any for ICollection? [duplicate],1
How do I secure API flask in order to be only consumed for my frontend app?,5
Restricting commands to procedure only in MySQL / MariaDB,5
meanthemes /meanMenu Links do not have a discernible name,1
Preload font file with hashed name,1
Efficient bitwise reverse of the successor,1
"A call is in progress. you can only adjust call volume my app notification receive mi device like MI 9T , redmi 4 How to disable it",1
"IIS does not scale, but cpu does not max out either, why is it slowing down",4
Should you expose a primary key in REST API URLs?,5
using numba with np.concatenate is not efficient in parallel?,1
google sitemap in a different server,4
WAPP Portable - 64 bit,3
"The remote copy of database ""<DBNAME>"" is not related to the local copy of the database",0
WS2 SP 4.4- HA failover issue,0
Lodash's shortcut fusion with lazy evaluation doesn't optimize,1
JWT sign. Two-piece secret key,5
How a typical cluster of five servers can tolerate the failure of any two servers?,6
Optimizing Apache 2.4 performance on Windows for serving a single file,1
Fixing/hiding Path Based Vulnerabilities in WordPress,5
Why is exception in Spring Batch AsycItemProcessor caught by SkipListener's onSkipInWrite method?,6
Is there any scalable open source file storage systems?,4
How can I resolve active session problem in JMeter,1
A relational database shared by an android app and a website - the easy way,4
Cybersecutiry: Springboot actuator env and info show connection string uri mongodb,5
How to compile PHP to be portable?,3
Multithread or multiprocess,1
Python Code Optimization (For-Loop & If-else) Advice for quicker computation time,1
How can overriding struct's Equals method improve performance in C#?,1
How to count the requests for each table of hive?,1
Should I explicitly tell the compiler to move the string in this case?,1
Ultimate way to host webapplications [closed],4
AspectJ - Pointcut method call fail to execute when called from other projects,1
Performance issue finding LCS with Haskell,1
How do I check/enforce the next cmdlet to take the pipeline object,1
What is the difference between MPI_Send() and MPI_Isend() followed by MPI_Wait()?,1
Opencv weird speed performance of convertTo and LUT,1
Gatling Login scenario with CSV feeder,5
Python - Looping through large list and downloading images quickly,1
Is it okay to run Django API server with root permissions?,5
Is the Cache Storage in a PWA secure? [closed],5
Removing metric in pushgateway removes the scraped metric in prometheus,1
Mysql 'Partitioning' vs Splitting data into different tables,4
OWL Carousel or Flickity? Which one is better?,1
Does stateless only transfers client's state to somewhere else?,4
Elasticsearch Securing the connection,5
IndexOf on string loaded from file - dotnet 5.0 half as fast as dotnetcore 3.1,1
Managing table which is frequently updated and queried,4
SQL Modeling Follower/Followed Relationships For Social Networking,4
Rest controller not registerring,5
Storing Keychain Keys in Core Data?,5
Injecting data to web application from AWS Lambda & CloudFront,5
Pandas merge is an order of magnitude slower than map for joining a Series to a DataFrame on a column,1
C# performance question,0
Early return from a script (without a function),1
"Any performance gain when using ""instantiating"" objects using `const` in Dart 2 / Flutter?",1
How to reference in settings a path to subdirectory within VSCode portable (relative to 'Code.exe')?,3
How to know when React component is ready for interaction,1
React Native - Native module vs JS performance,1
Improving speed of varchar(max) queries,1
Printf %x string vulnerbility and stack interaction,5
How to remove keychain access to visual studio on a mac?,5
Safely Include Sensitive Value in a text SQL Server Migration file,5
T4CConnection.doDescribeTable() call for every insert statement?,1
Memory and some more information about JavaScript,3
How to write a function to matches values in two dataframes (make a faster version),1
Azure. The system memory and CPU change cause slowdown app respond?,1
Building highly scalable web services,4
Speeding up a User Defined Function in Python,1
How can I update an entry in a HashMap with a refrence to a key?,1
Iterating list performance,1
Security of getting access key from auth server,5
OCaml as a compilation target,3
Queue handling in HTTP server with heavy load,1
"portability, should csv file use CRLF line feeds on windows",3
"Why is LOOP faster than DEC,JNZ on 8086?",1
Portable XAML Styles in a Class Library,3
how do web servers handle large ( millions ) of clients at the same time?,4
PHP - How to use csrf token in multiple forms on the same page,5
Unable to start Corosync Cluster Engine,0
What is the probability of time.time() generating the same result in a loop?,1
API or any source to download all CA certificates,5
secret management in on premise application,5
unable to access to the activity by user who was already added by admin,5
Defining Scaling Threshold for Azure Web Roles,4
"Groupby and Aggregate over a pandas column with list as elements, and get unique values in list",1
Is it safe to assume sizeof(double) >= sizeof(void*)?,3
Changing default Apache version on Mac OS,5
Google Cloud Platform Load Balancer - The load across the PODs are not so even,1
A partition tolerant relational database [closed],4
Best Practice: Spring boot application behind a proxy or direct?,5
Kubernetes single point of failure and load balancing,0
VBA Code execution time question...Why does adding a Dim statement speed up a call to a blank Sub? [closed],1
MongoDB Performance in Docker,1
How last thrown Exception contains previously thrown Exception?,6
Gather a split 2D array with MPI in C,1
Cassandra crashes during simultaneous reads and writes on EC2,4
how to avoid remote code execution in webview appcelerator?,5
Python xarray load specific points and variables of a nc file,1
How to prevent form hacking in client-side code,5
How can I implement Fast Gradient Sign Attack for Tabular data?,1
Scalable Contains method for LINQ against a SQL backend,4
Security Implications of JSONUtility and how to make secure if not,5
"In Angular, how to prevent a user from changing from the current tab?",5
Operation speed on different types,1
Can we use owasp zap for mobile application,5
Redundant calculations in python list comprehension?,1
Is libwebp 0.3.0-3 used by pillow on Centos 7 concerned by CVE-2020-36328?,5
Running bash script in backend safe?,5
Time complexity mapping multiple times over a list,1
Python how do i make list appends / extends quicker?,1
How to avoid of huge if condition using BigDecimals?,1
Buttons and touchables on React Native lag with delay,1
"When measuring scalability, should you split the workload across multiple clients, or give all clients the same workload?",4
Injecting thread with codecave,0
Portable c++ atomic swap (Windows - GNU/Linux - MacOSX),3
Grails Caching Plugin and Scaling,4
How to protect CODE TAMPERING in Flutter?,5
How can I know if socketIO will offer any benefit over long-polling?,4
What type of file is encrypted by EncryptedFile,5
Efficient way of querying string and number field from PostgreSQL's json field,1
Escaping user inputted data - WordPress Shortcode Attributes,5
Get file / directory Owner as displayed in Windows Explorer,5
Is type hinting make script execution faster inPHP8+,1
Why is aspnet preventing browser page caching when a csrf token is present?,5
Diskless Nodes boot,0
getDeviceId: The user 10214 does not meet the requirements to access device identifiers,5
IEnumerable<> vs List<> as a parameter [duplicate],1
Is time.process_time() a better measure for performance than time.time()?,1
Kotlin execution time almost 20 times higher depending on invocation order [duplicate],1
android Home Page - best practice,1
Virtual IP for PGPool 2 not working,0
How to improve pervormance of String processing using Stream#reduce?,1
Dealing with large data binary files,1
Will reloading all TDE templates tigger reindexing cause ML Performance issue?,1
Scalable WordPress website and optimal load speed in several countries,4
How can a Callgraph detect malicious code?,5
Making a website/project Portable - Check List,3
Numba correct implementation?,1
Secure way to let user create their own password with ACF registration form in Wordpress?,5
DB Agnostic ASP.Net?,3
Difference in performance between Math.sqrt and Math.pow against Math.abs in JavaScript?,1
Force classes to implement one of a set of methods,2
Difference in CPU usage statistics,1
Why OpenZeppelin's address.sol says that plain call is unsafe in solidity,5
Prove to my customers that their data in AWS is encrypted,5
Digital Watermarking: Blind detection with linear correlation,5
Is it possible to use SQLMAP against an ODBC driver connection?,5
Extremely slow socket data throughput on Android 11?,1
Command line showing nothing no output,5
How to query GCP tables fast,1
How to stop Stringify method once object is detached from RecyclerView?,1
Conditional combination of arrays row by row,1
Can loops affect other loops' complexity without being inside it?,1
Improve performance on Python object comparison,1
Fast method to dispatch computation according to tests in a function with array as argument,1
Why np.float32 may perform slower than np.float64?,1
Should I create separate collection in firestore for separate type of users. Will it affect performance if I have huge collection of users,1
Angular- OIDC code flow - Is there a way to get the authCode from the redirected URL if the Redirect URL is to an external application?,5
"How can I add a key to an account after creation, e.g. for multisig contract, using near shell, near repl or near-api-js?",5
Maintainability index for over all angular.js project [closed],2
How to change for loop to work efficiently python,1
"how can I define ""remember me"" for each one separately? Symfony 5",5
Unauthenticated HTTP GET attempts on obscured endpoints (asp.net mvc),5
How do I get the first and last 10 records in a table?,1
experience with play! framework big applications maintainability,2
Intended granularity of Hystrix commands?,6
How can I implement incremental wait time for django axes?,5
Is a Greasemonkey script that uses unsafeWindow secure as long as the @grant type is 'none'?,5
Can't we enforce a limited number of attempts to prevent quantum computing from cracking our RSA encryption in the future? Or am I missing something?,5
"How to correctly edit scalability settings/groups in Unreal Engine 4? To ""overwrite"" the default one's",4
How do I fix my devtool React user timings?,1
Python: pixel manipulation pefrormance. Virtual desktop for embedded device,1
"How to do portable 64 bit arithmetic, without compiler warnings",3
NoSQL database and many semi-large blobs,4
How can I prevent that bots are generating costs at my AWS Lambda Function,5
High availability : Jobs not getting submitted immediately after name node fail over,0
"Trying to use ""Run once only"" controller with ""If"" controller but sequence of requests is changed under the thread group",1
How to store external keys / secrets in android strongbox?,5
How do I make this compatible with Windows?,3
Are there penalties for just using the new keyword instead of creating a class variable before calling the class method?,1
Mobile Menu Issue – LiteSpeed Cache,1
Scaling application that reads large XML files,4
Swap 2 values of 2 variables without using a third variable; python,3
"how to validate a random variable in jmeter, if it is unique or not for requests",1
Portable python app to run on remote systems,3
Is there a way to speed up python via float precision or limiting float range?,1
How to handle secure cookie in localhost,5
prom-client - What does `nodejs_eventloop_lag_stddev_seconds` measure?,1
"In azure data factory copy activity ,fault tolerance is not applicable to check constraint",6
Erlang mnesia database access,4
What is exactly the function of the 'max_file_uploads' limitation?,5
How to monitor the command lines that are executed in gcp at the logs level?,5
aggregate lookup vs 2 find query performance mongodb,1
