RequirementText,class
Spark 2.4.0 Structured Streaming Fault Tolerance from Kafka,6
How to restrict access to REST API used by Angular application,5
WSO2 esb load balancing benefits,0
Using FLAG_SECURE stop exo player mirror casting in Redmi devices,5
Is it safe to send the sensitive data with window.postMessage?,5
How to decode a JWT token with TinyGo,5
Python: Program running Slooooow,1
"Google Apps Script: The code is working as intended, but the time to complete is quite long. How can I reduce the script time?",1
Pytesseract really slow,1
Does Intel MKL redefine functions from math.h in C?,1
PerformanceMonitorInterceptor : Logging time in ns,1
Connection refused error while connecting to jmeter slave docker container,1
Which certificate for digital signing a visual studio integration extension(.vsix) with VSIXSignTool?,5
Hibernate time to first action - too slow,1
How to add Security Headers in Vue App running on tomcat,5
MongoDB Index in Memory with Sharding,4
Should I disable Knex.js connection pool in HA setup?,0
cheap way to scale a rails application,4
How to prevent the GCP console from being accessed by mobile? Or at least requesting the password?,5
What is the best way to securely store Constants and Parameters for the servers to use it on runtime?,5
Cybersecurity project [closed],5
How to model 1'000'000'000 cells in React?,1
How to handle the authentication between microservices when the application originates the call,5
Very slow connection to Snowflake from Databricks,1
redux calculated data re-rendering how to fix,1
Is there a way to perform agglomerative clustering in batches in R?,4
Is it possible to ignore failed tasks in Spark,6
Why this `__xstat64` cost this much in perf?,1
How to calculate real-time stats?,4
Why calling a query as a view takes lots of extra time to be executed?,1
How to prevent JWTToken gets exposed in the same network if the system is online?,5
"OpenCL local int pointers hangs GPU, works fine on CPU",1
Connectivity issue with ActiveMQ Artemis HA backup server,0
"Cloning a Postgres table, including indexes and data",1
Security of .env file (enviromental variables) in React JS App,5
hotstandby postgresql server having passwords of master server,0
Is there a better way to check a flag and then set optional parameter in a function in javascript? (Writing function in a js object),1
My IOS app to monitor usage of other installed apps,5
Flutter GridView.builder scrolling jittery and choppy,1
Was slf4j affected with vulnerability issue in log4j,5
Leetcode word ladder : How is this solution most efficient?,1
Selection of Database to insert millions of rows everyday to plot graph for each user,4
Database for Python Twisted,4
Is SecurityContextHolder necessary,5
Segmentation fault on one Linux machine but not another with C++ code,3
Incremental update in column value in mysql. Concurrency Issues?,4
How does relying on type inference affect code maintainability?,2
Codeigniter 3.1.11 / Jquery (AJAX) doesnot pick up the value of csrf_cookie_name using $.cookie,5
"can't reach maximum performance of lettuce( spirng data redis reactive, webflux)",1
AWS IAM Allow Only Resource Creation,5
How to fix CVE-2020-7663 | CVSS Score: 7.5 vulnerability,5
How are code-branch side channel attacks mitigated on Java?,5
How to communicate between User and Server via https,5
Does ray tracing scale better with light count than rasterization does?,1
Dynamically generated checkbox list performance issues (React),1
Get internal array of HashSet<T> in C#,1
Do large systems use foreign keys in their databases? [closed],4
SolrCloud: high availability? Don't see it working,0
"Power Platform Canvas App only environment, app user permissions",5
how to limit the amount of digits of a function in Julia,1
Postgres count(*) extremely slowly,1
How to secure an endpoint,5
Flexible RBAC role extension in runtime by toggle flag,5
JINT performance is significantly worse when an application is run as a 64bit application,1
zend framework with load balancing,4
Is the for loop in my code the speed bottleneck?,1
What is the best practise to secure data from back to front with archive,5
What does a web-based framework scalable?,4
Push data dynamically to Highmaps,1
Diablo 2 - Improving Algorithm for validating runeword recipes,1
Add authorization to php api for android app,5
How to fix list comprehension 'bitwise_and' error and optimize for-loop?,1
Lazy loading data in Dapper using HotChocolate GraphQL,1
Fast refresh materialized view on Oracle version 19,1
How to protect routes in SPA?,5
How to protect my API from redirected fake static http requests,5
how to access portable usb storage device from android code?,3
Is it safe to echo formatted DateTime in php in terms of XSS attack?,5
java.security.NoSuchAlgorithmException: Ed25519 KeyPairGenerator not available,5
Does row-level security (RLS) apply on a join statement?,5
How to scale a program for reversing a String?,4
How to have two load balancers on two different subnets?,0
How scalable is distributed Erlang?,4
Efficient row reading with libpq (postgresql),4
How do I make my data structure more efficient?,1
logical execution time vs wall-clock time,5
Problems with the estimation time of mixed logit models in R,1
fastest way to merge two table with key (python) and duplicate,1
granting access to multiple files on mac,5
Improving execution time of this nested loop,1
Tomcat Ha conditional start of slave node,0
How to ensure the security while implementing OAuth 3 legged authentication process of Twitter?,5
How can I speed up this Python function?,1
How to use option Arbitrtaion=WaitExternal in MySQL Cluster?,0
MongoDB SDK Failover not working,0
A way of direct peer to peer data transfer with node.js?,1
Slow frame rate for gstreamer stream,1
Risk field with blank value for many alerts in OWASP ZAP alert details,5
Rails ActiveRecord::Associations::Preloader not working,1
Why is the sklearn LDA transform VERY SLOW?,1
Two Questions Regarding AWS' RDS Multi AZ,4
Speed Issues with shuffling in a torch IterableDataset,1
"Change the ""Run as"" property in a Data Collector Set with Powershell",1
Safe assumption regarding size and alignment of datatypes on different platforms?,3
How to accelerate my written python code: function containing nested functions for classification of points by polygons,1
Parallelizing a 1D matrix multiplication using OpenMP,1
Creating a static C library for Linux that is portable across different GCC version,3
Make copy-paste code faster triggered by button at different locations,1
"Populating new Dataframe in Python taking too long, need to remove explicit recursive loops to improve performance",1
checkmarx medium severity: May unintentionally allow setting the value of method in the object,5
How to use blank df and lists to speed up processing time in R,1
is it possible to store sessions with google cloud storage or s3?,4
[SqlException (0x80131904): Login failed for user 'DLU\DLU09$'.],5
Java: How to check whether a certificate is self-signed,5
C Dynamic linking and security of signed tokens,5
Security threat with browser extensions,5
Configuring RabbitMQ cluster with NServiceBus,0
is it possible to create portable x86-64 Linux executable with ocamlopt ghc and gcc compiler?,3
How to filter out rows in a Pandas DataFrame that contain a specific subsequence in a list-column?,1
Queues in Racket?,1
How to load balance (scale) a simple PHP application?,4
Intel(x86_64) 64 bit vs 32 bit integer arithmetic performance difference [duplicate],1
How to get the token from pod in kubernetes using curl command,5
Portable way of printing hexa values with sprintf,3
MySQL config uses 1G per thread - how do I reduce that?,1
Dependabot/Snyk tool like for Rust and/or Elixir languages,5
How to clear/reset results of the Python line profiler?,1
Spring Security:I can load static resources but not images,5
Performance difference between summing iterator of 1 with if v.s. iterator of boolean condition,1
python beginner performance : for loop Vs iterator Vs Pandas,1
Does truncating a keyed hash make it more secure?,5
How to the increase performance of a Python loop?,1
tmux logging history of detached panel,5
What are the risks of not hiding my API key and secret?,5
How can I test web performance for PHP website on localhost?,1
I'm using container managed security for my jsf project. Am I supposed to use filter class to do authorization? [duplicate],5
Connect to HDFS HA (High Availability) from Scala,0
Secret info & EC2 CodeDeploy?,5
Centralized identity management with different providers,5
Scalable way to keep track of user activity,4
How can I implement domain-level security,5
paho-mqtt in frontend: only logged in users should be able to connect to broker,5
Big O Complexity of this double loop,1
Graph algorithm - Looking to improve scalability,4
QML Performance issue - Qml is rendered with a large delay on Linux,1
Securely delete Docker container or image,5
Best place to do sanitise PHP form data,5
Speeding up a for loop,1
Stackexchange Blackbox is not working with Perforce,5
Prevent XSS in CKEditor,5
Jolokia access with custom JAAS,5
Stored Procedure Execution Time vary every few minute,1
Image taking ridiculously long to render when resizing frame,1
"Does storm support ha host, e.g. for the nimbus host?",0
Portability and length of std::string on Windows vs. Linux,3
why when I add secure-ls to vuex-persistedstate the vuex information does not have the session data as it was before?,5
Client-side URL redirect error for $route.hash,5
Which software can handle the following?,1
Microservices not registering on all Eureka Instances,0
LSB AppChecker: GCC links against unused libraries,3
Best practice for storing images in an app to reduce mb,1
StackExchange.Redis memory leak when cluster becomes unreachable,0
Conditional Compile - Implementation Alternatives,3
openstack overkill for HA website stack?,0
Should I use Resharper to tidy up other peoples code?,2
Bad origin PSI scores for desktop,1
Julia - Why using macro @info generates bad @code_warntype performance?,1
Difference between emberjs and jqueryUI,4
"Improve PHP performance : PHP $_SESSION v mysqli($servername, $username, $password, $dbname)",1
AEM 6.5 Oracle DB NoClassDefFoundError,5
"Does ""volatile"" guarantee anything at all in portable C code for multi-core systems?",3
Stripe Security Concern on Django,5
Finding best match by expression,1
Managing guest API consumption with Vuejs,5
How to login and scan with OWASP Zap,5
Cannot attack Tpot virtual instance,5
Is setting maxResult and firstResult of JPA entityManager more efficient than getting resultList and then parsing?,1
Execution rest api rules vs java embedded,1
asp.net Page.PreviousPage Scope,4
REST: Best way to deal with secrets in DELETE,5
Fastest way to generate two random numbers from the same range,1
"What is the relation between performance and attribute ""frame-pointer"" in llvm IR?",1
Redis sentinel with multilevel replicas,0
Operations on Data Frame passed to function are very slow,1
How to loop the jquery call more effectively instead of looping multiple times,1
Windows Receive Side Scaling (RSS) configuration/tuning for performance,1
How does Java's JIT compiler make bad code faster than good code?,1
Node js jwt authentication,5
RTOS: Context Switching - Calculate TCB Lookup vs. Memory Access,1
parallelized groupby: apply a function to a groupby object simultaneously,1
Speed up python code os.walk() glob file lookup,1
Secure raw SQL query in Django with psycopg2,5
How to execute a treatment in the background?,1
Android - Performance fall when rendering image,1
Best way to obtain a secure connection using Python urllib,5
Hosting a multiple domains in pyramid,4
Quay Clair - Could not get an output on scanning the container images,5
Flutter is faster in debug-mode than when released,1
Is there a more efficient way to write this loop? [duplicate],1
Are Azure Application Client ID's safe to store in the frontend?,5
"Why when one of MongoDB replica set shard members goes offline, the others CPU`s spike to 100%?",0
High Availability Groups and Fail Over,0
Scalability problems pivot table Pandas/Numpy,4
Get output from Android Studio Profiler [duplicate],1
Optimising a large SELECT/JOIN query with millions of rows,1
"How to use performance.measure in firefox,",1
NGINX redirect http to https (problem reducing first-byte-time),1
How to Import parent service dynamically?,1
MQXR load balancing and request/response,4
"Secure frontend to backend call, sensitive information",5
SignTool not picking up the certificate,5
"How to configure SQL Server Native client 11.0 for Failovers, High Availability, Disaster Recovery",0
Implementation of ISO 27001,5
Using cmov to convert conditional branches into indirect causes branch misses to increase [duplicate],1
Kafka scalability if consuming from replica node,0
Getting an Image Vulnerability error for node.js for path-parse Prisma Cloud,5
Tips for increasing performance for bson.json_util dump function,1
Why does glibc's strlen need to be so complicated to run quickly?,3
"Choosing DB model for an app similar to Notion, Block-based (""paragraphs"") or document-based?",1
"XGBoost has a high AUC (>0.9) in training dataset, but low AUC (<0.7) in testing/validation dataset",1
Why is C++ template use not recommended in a space/radiated environment?,6
How to improve performance? Working with pandas,1
"Running a DDQN on CPU-only tensorflow, my laptop is 50x faster than my AMD 3900",1
How to bypass Firefox restriction to show external widget?,5
Finding an applications scalibility point using JMeter,4
AR Application in WebGL has terrible performance,1
how to count the match number between two dataframe fast?,1
Kubernetes Pod/Service Architecture,4
Magic numbers for parameters or method overloading?,2
Keycloak User role and Admin Role as part of a Group,5
React Native - How to create a correct Dependency Check / Vulnerability Report and handle it?,5
Which way of using DataBinding is faster,1
How to speed up if statements with for loop,1
Properly handling platform specifics (unix/windows) in C?,3
"Information in .well-known/openid-configuration page is exposed to internet, a security concern?",5
Efficient Way to Repeatedly Split Large NumPy Array and Record Middle,1
Android KeyStore: Is it possible to set up a custom password for authenticate the Key user so that they can use the key from the KeyStore?,5
How to Use Performance Monitor to graph number of active Windows 10 processes?,1
JSON multiline file performace tuning,1
Maintainable mocks,2
Simplest way to convert this array in to the specified one using Java,1
How to set chunk size in tsfresh to increase processing speed,1
How to get detailed Performance Tracking in Laravel?,1
is use parcelable with entity room and API post is wrong?,1
"SQL Server : getting execution time out exceptions from stored procedure many times, but when executing the query it returns output quickly",1
Zookeeper config with encrypt passwords,5
Adding ranges to count overlap python,1
"Why does Youtube use Insecure RTMP, considering that Facebook uses secure RTMPS?",5
How to handle loadbalancing in Solr?,6
Whether to pass shared pointer or raw pointer to a function,1
How do I restrict a resource handle I generate to one client from a linux shared library,5
Content-Security-Policy header/meta for hCaptcha not working,5
Can I run multiple Spark History Servers in parallel?,0
Time recquired for OpenCL kernel deletion,1
How to scale effectively in windows azure?,4
The same AVX instruction set code has a huge performance gap between Intel Core and AMD Ryzen,1
Why don't numpy arrays remember that they've been sorted?,1
Using a NoSQL system to store session data,4
SQL Server work on small sets of data in a large table,1
error ERR_HTTP2_INADEQUATE_TRANSPORT_SECURITY on google chorme [duplicate],5
Is it recommended to use ASP.NET user management system on high traffic website,4
Why can't I access static content with Windows Authentication in IIS,5
Single fault tolerant machine with amazon AWS,6
Aggregate values in pandas dataframe based on lists of indices in a pandas series,1
G Suite Content Compliance using Regex to quarantine emails sent to 5 or more members,5
How much extra resources does compiling/running a program with GCC coverage instrumentation consume?,1
Can a guid be a good partition key?,4
Snowflake cluster Security in multi tenancy,5
"Performance Issue of SQLServer Columnstore Index: ""Where OR"" will influence predicate pushdown",1
Inconsistent cold start query performance in Postgres query,1
How would you architect a three-tiered web application to limit downtime?,0
MacOS Big Sur 11.2.3 reaquires permission for every step,1
jquery foreach loop taking long time to append html,1
Developing webapp on mobile - https security problems,5
"Does Windows have (process, network, filesystem) container functionality similar to Linux? (Without Docker)",5
What is the surest way to authenticate (login) via HTTP?,5
How can we check that a binary EXE (PE) is COM Exe or Win32 Exe?,3
How to use non-default Google Service Account credentials with SecretManagerService in Google Cloud Function?,5
Java Streams: Is the complexity of collecting a stream of long same as filtering it based on Set::contains?,1
if(X){if(Y){ versus if(X&&Y). Question about efficiency,1
Return a reject table from a stored procedure,6
Storing API Keys submitted by client in frontend,5
Which data model is better?,1
g++ link an .a file and its dependencies into a static .so,3
array initialization run time comparison ifort vs gfortran,1
Apple mail client open rate adjustment calculator,1
Pass Bearer Token on GET Request on EITHER Google Chrome / Safari / FireFox / Etc,5
"vb.net - geckofx45 how to ignore ""site.com uses an invalid security certificate"" error",5
Remove duplicates in a json object array,1
Optimization Python Loops for Algorithm,1
JWT and authentication safety/patterns,5
Matlab computation of L2 norm is very slow,1
Efficient way to load lots of images in python [closed],1
dense matrix vs sparse matrix in python,1
"If values exist in list, put them at the back of the list in Python",1
Spring security config defaultsuccessurl() annotation,5
How to optimize the nested for loop with different lengths?,1
Filtered_data error when removing outliers using perfomance package,1
How should I deploy Traefik in my environment?,0
nested query on active model serializer attribute,1
how to scale databases,4
Why allocate_at_least() in C++23?,1
Mockserver in dev profile spring boot,1
How to (su) switch user on amazonlinux docker image? [closed],5
Send Post request concurrently for a list of employees (No Access to API for supporting list of employees in POST body),1
Detect stopped server process via rpyc.Connection,6
SQL join performance operation order,1
MS SQL Server 2008 R2 spatial: not consuming enough CPU,4
Jest - prismacloud raising an vulnerability due to SET-VALUE dependency on old version,5
How to achieve Provider.select behaviour using built in InheritedWidget like MediaQuery?,1
JavaScript: what is the fastest hexadecimal string to ArrayBuffer algorithm?,1
is there cryptographically secure hash algorithm/function that allows hashing faster when you concatenate more data?,5
"Hadoop HA active NN keep crashing, and auto failover doesn't work",0
How to scale MongoDB?,4
Modular Arithmetic in programming [closed],4
how to list all publicly accessible GCP resources?,5
How to check if an Android device allows to install untrusted apps from outside the store?,5
RolesAllowed Annotation in Jersey REST-Servlet not working,5
Efficient way to convert flat data into nested group in C#,1
Can a database be added to an HA group online?,0
I want to encrypt newgroupkey using publickey and they decrypt it. How to do that?,5
How to replace deprecated KeyGenParameterSpec.Builder.setUserAuthenticationValidityDurationSeconds?,5
How to cluster an application,0
I want to use the one api's result into another api in karate-gatling. Both api's are being simulated in gatling [duplicate],1
"Simplify Overriding Equals(), GetHashCode() in C# for Better Maintainability",2
How to change database details in JPA,0
How can I analyze a file about to be uploaded before it's actually uploaded?,4
Where did HazelCast map.get() go? And scalability concerns,4
"When an application cluster in one data center fails over to a different data center, what happens with the connected Redis machines?",0
Django SimpleJWT: Some questions with token authentication,5
Bad practise saving sensitive data in .env file,5
Distinguish closure classes,3
how to make my query select variables faster,1
Is it safe to SSH into a server while on a public VPN?,5
How to scale php application servers horizontally?,4
Safe password transfer between client and server [duplicate],5
Problem figuring out time and space complexity?,1
Making and Applying Linux Security Patches,5
Some questions around sockets and accept(),6
How to fix Weak TLS 1.2 Encryption,5
Allow POST to google cloud functions but not GET?,5
How can I prevent PRs from changing my CI configuration?,5
Is Levenshtein distance algorithm performs better than Needleman Wunsch Algorithm?,1
Microsoft Defender for Cloud - Vulnerability Alerts,5
Scaling from one server to multiple servers,4
Compute Approximate Value of Matrix Operations With Math.js,1
Pass CString to fprintf,3
which authentication token should i use?,5
How to create the program after finished programming it in C#,3
Sudden Scaling of Simple Node.js App,4
what are the technologies for building real time applications using Node JS?,4
Comparing models that predict different things,1
Python serial read fails for long period,1
Are previously made HTTP Requests accessible via Javascript,5
Aspects that affects the efficiency of OpenMP parallelism,1
Should I run haproxy for db and redis sentinel on web nodes?,0
Does multiple concurrent setInterval() affect performance?,1
Can't a website/server owner read the passwords out before hashing?,5
Multiple update statements vs one big update in transactions [duplicate],1
Is there any way to boost the speed of pandas program for large dataset?,1
Benefit of Erlang for collaborative real time application,6
Is VSCode vulnerable to CVE-2020-15999?,5
Is there any performance difference between different linq usage ordering?,1
Use of node js to search contents on an in-memory file on 100000 PCs,4
Java: How to check size of file without opening it? [duplicate],1
Securely Saving Jgroups Security SASL Password,5
How to convert unix epoch time to datetime with timezone in pandas,1
AWS CLI script to change security group of EC2 to match currently assigned IP address when using VPN to obfuscate network traffic?,5
why does GDB lower its privilege during debugging?,5
Unable to connect to DVWA,5
OMP SIMD logical AND on unsigned long long,1
pynput and GlobalHotKeys not receiving any keyboard events,3
Is there a more efficient way of storing keyword arguments?,1
Behaviour of SAML when HTTP Server used for high availability,0
Remediating .NET Core App 3.1 open source dependencies vulnerabilities,5
Severe & Bizzare performance issue,1
"For node-postgres (""pg"" library), are session variables safe doing Row-level-security?",5
How to initialize inherited templated POD struct in derived class portably?,3
How does appfabric caching failover work?,0
Kubernetes HA: Flannel throws SubnetManager error,0
Fastest way to remove extra blank space - in VBA excel,1
MySQL 8.0.18: Key Efficiency 0.0%,1
Portable Python Not Starting Script,3
How Locust can extract value from response then using for next sequence request,1
Scalability issues with server based authentication,4
How to get a list of all vulnerability alerts in a GitHub organisation?,5
Performance drop when slicing jax.numpy arrays,1
Storm's fault tolerance: is the data lost when a worker died,6
Multiple region availability of users in firebase,0
Does TInterfacedObject automatic memory management also work with C++Builder?,3
MongoDB update operation performance,1
Efficiently Query and Save Most Recent Date of Boolean Columns,1
how to do fast read data and write data in mysql?,4
How to get first two word from a string value,1
Docker scan command is not working for an image in local registry,5
Bypassing 2FA | Google Authenticator [duplicate],5
How to iterate at elements from a sub list and then remove the sub list from the list? With great performance,1
Should I avoid nested functions?,1
Julia - How to cat UnitRanges and prevent bad type performance,1
"What is considered a ""padded"" UDP package - when does it actually have no payload?",5
Content-Security-Policy (CSP) URL doesn't seem to have any effect. Still reporting a violation,5
How to optimize a O(kn) query that looking for matching alerts between 1 000 000 (k) alerts and 5000 (n) smartphones (~24 hours time process),1
Improve efficiency of selecting values from dataframe by index,1
MySQL cannot run query for time restriction,1
Applying package updates to ubuntu for a laravel app,5
How to properly secure post requests with Django RF apis?,5
Presto Coordinator does not have support for High Availabiltiy,0
SQLAlchemy - raw SQL - slow when returning large dataset,1
What is a fast async text writer that can be used to log a line of text to a csv file?,1
Availability Set not in Dropdown,0
Changes to VMs in Availability Set and Load Balancing,0
Python memory consumption when using pickle.load vs process memory usage,1
How to design scalable video streaming architecture using GCP?,4
Are Golang goroutines (relatively) the same as C# tasks? [closed],1
MongoDB - Get the first matching document multiple times - Which is better?,1
Scalable database query,4
Improve many-to-many Query Performance with Pagination using Laravel 4.2,1
How can I protect against inbound malicious website threats on port 80 and 443?,5
Most efficient/cheap way to send/store data on GAE,4
